t***2,2017/6/8 19:29,1717红色,43,鞋子非常时尚，穿着也很舒服，老公很喜欢！跟图片上一样漂亮！图片上的鞋子已经被穿了几天了，有点脏了！?,,,,,,
砍***孩,2017/6/7 22:03,1717红色,41,鞋子收到了，抱歉这么久才评论，质量还是不错的，这个季节穿着挺舒服，样子也不错，而且价格可以，值得一买,,,,,,
东***头,2017/6/7 22:57,1300黑白,43,评论有点迟，不过这样才更有话语权，经过一段时间的使用，更加能发现此鞋的优点，不仅帅气耐穿，而且真的很舒服，也不捂脚，十足的休闲范儿！,,,,,,
t***2,2017/6/12 16:05,1793黑金,40,50块能买到这么合适的鞋子 真心觉得特别的值得！里面还有香包 一开盒子香气扑鼻！宝贝非常的好 祝店主大卖！,,,,,,
我***0,2017/6/8 15:45,1717黑色,42,穿着感觉是挺不错的，鞋子挺好看的，穿着很轻的感觉，夏天穿不会太闷，也不容易有脚臭，50块很便宜了，物美价廉，但是还是希望多出点新的款式，会比较好&hellip;,,,,,,
没***海,2017/6/12 17:13,5570黑红,40,穿着感觉是挺不错的，鞋子挺好看的，穿着很轻的感觉，夏天穿不会太闷，也不容易有脚臭，50块很便宜了，物美价廉，还是希望多出点新的款式，比较好&hellip;,,,,,,
a***9,2017/6/1 10:54,A877白红,43,价格实惠，料子是帆布的，透气性好，大热天的穿个皮鞋两个脚丫子跟在蒸桑拿一样。?还是穿个帆布鞋好点，几十块钱看着还不错，,,,,,,
勇***1,2017/6/12 11:00,1717黑色,42,鞋子收到很不错，是我喜欢?款式，鞋子也很软，不打脚的，朋友都说穿起来很好看都要来买呢，特别是老板服务很好啊，谢谢你的礼物哦，非常满意,,,,,,
s***p,2017/6/7 18:08,838黑红,43,第二次购买按平常穿的尺码拍大了两码  垫上鞋垫很合适了   颜色很喜欢,,,,,,
然***悦,2017/6/12 11:27,1717黑色,41,不错，很满意，特别满意，等下次再来买，多推荐朋友来购买，确实很划算，质量也不错，穿着也很舒服！！！,,,,,,
额***宝,2017/6/9 16:47,838黑金,43,不好意思，现在才评价。我是给儿子买的，害怕这个鞋的质量不好，没想到鞋的面料挺好，码子也正好，很满意得一次购物！有需要了再来买,,,,,,
x***2,2017/6/8 20:44,1717白绿,43,鞋子很好看，穿上也非常舒服，穿着去巴厘岛，走路也特别轻松，不输大牌,,,,,,
l***4,2017/6/8 9:09,A877白绿,43,鞋子看起来挺漂亮的，是布的，刚穿，，，挺合脚，，后续再来评价，，，,,,,,,
太***衍,2017/6/11 18:52,X6灰色,39,收到鞋子很惊喜，没想到这样的价格买到这么超值的鞋子，外观质量都满意，五星好评,,,,,,
凉***l,2017/6/3 21:51,1300黑色,39,质量不错    鞋子是比较透气的面料    类似网鞋    但是鞋子的整体款式还是比较简单的    穿着很舒服   大小也合适   弟弟很喜欢,,,,,,
小***6,2017/6/9 19:22,D01白色,40,鞋子很不错，穿着舒服，很适合搭配一些夏天穿的蓝色牛仔裤，非常喜欢，五颗星,,,,,,
t***5,2017/6/10 17:02,3399黑金,42,穿了一天了，很不错，这价格能买到这种质量，有点惊喜的感觉。平常穿42码的鞋，这次拍的也是42码的，很合脚，赞一个,,,,,,
姜***乾,2017/6/9 10:19,3399黑红,42,尺码：鞋大小合适，号码标准，鞋底很有弹性，穿着很舒适。。,,,,,,
钢***镝,2017/6/12 11:29,838黑白,42,尺码：是正品，质量非常好，款式漂亮，穿着舒服，特别轻，走路一点也不累，没有难闻的气味，性价比很高，与卖家描述的一样，发货快，卖家态度特别好 好 热情 挺好的！。,,,,,,
欣***1,2017/6/12 15:56,2299黑金,41,是正品，质量非常好，款式漂亮，穿着舒服，特别轻，走路一点也不累，没有难闻的气味，性价比很高，与卖家描述的一样，发货快，卖家态度特别好 好 热情 挺好的,,,,,,
h***5,2017/6/9 21:58,1717黑金,44,宝贝收到了，打开鞋盒的那一刻，一下子惊呆了！！！！质量非常棒，么么哒！做工细致，设计合理，舒适度很好，鞋底很软，透气性很强，颜色漂亮，喜欢，大爱&hellip;&hellip;&hellip;！,,,,,,
t***1,2017/6/8 19:15,1717棕色,40,第一次买鞋子，鞋子也正常合适，我老婆说都说好看，宝贝跟图片描述很好，非常值得购买，,,,,,,
爱***福,2017/6/9 12:46,1717红色,42,还不错，穿了半个月没有任何破损，还挺透气的，外挂还可以，喜欢的可以考虑一下。,,,,,,
娄***阳,2017/6/11 11:00,1717棕色,39,物超所值，物美价廉，很不错！鞋子比我想象中的好很多，刚开始还有点味道，过几天味道就散了，穿着很舒适，也很帅气！本来以为几十块的鞋子就这样了，没想到给了我惊喜，很好，值得推荐～,,,,,,
海***悦,2017/6/8 20:20,A877黑白,40,鞋子还不错，穿着也挺舒服，就是不知道能穿多久，质量到底怎么样穿穿才知道，是我喜欢的款型帆布鞋！若果好下次还买，物流很快！,,,,,,
q***1,2017/6/7 19:38,1717白黑,41,这是我买得最实惠的鞋子，尺码大小刚好,,,,,,
潇***0,2017/6/12 11:00,1933黑红,39,给老公买的这款，他喜欢的不要不要的，说总算给他买了一件还不错的宝贝。穿着很舒服。洗了一次也还挺好。,,,,,,
黄***丶,2017/6/1 11:03,838黑白,43,鞋子质量还是不错，比较实惠 相对实体店来说还是这里好，总得说各方面斗很好，夏天来穿也不会太热，下次有需要还会来，很愉快的一次购物。,,,,,,
t***东,2017/6/11 17:32,1793黑金,43,鞋子最满意的地方是很轻快。黑色沾点土就很明显。,,,,,,
m***你,2017/6/3 16:08,1717黑金,43,鞋子很有型，颜色搭配很漂亮，鞋底很软，穿着舒适！价廉物美！卖家还贴心的放了薰衣草的香包，一打开香香的，还送了袜子。,,,,,,
奶***地,2017/6/8 0:32,2323白绿,41,！大小正好，然后鞋子穿上挺舒服的，值得这家是老店阿，第二次买了，值得。,,,,,,
a***9,2017/6/9 10:33,X6灰色,42,挺好额额额，当天九发货了，而且很快就到了，很文艺的鞋子哦。就是我穿着容易弄脏。不过用刷子一刷就变新了，期待能穿就一点。,,,,,,
小***国,2017/6/3 13:48,1717黑色,43,很好的一款布鞋，透气性好，款式很酷，价格不贵，谢谢卖家推荐尺码合脚，脚板宽平时穿42，这次拍大一码43码正好，下次还会关注，给五星好评！,,,,,,
嘉***6,2017/6/8 20:57,1717白绿,40,百搭鞋，质量上乘品，绝对的划算对于这个价钱来说！赶紧下手吧（重点是百搭鞋）,,,,,,
幸***缘,2017/6/7 18:31,006黑红,41,006黑红，情侣款为其中的男款，尺码为41 鞋底有弹性且比较耐折 卖家和物流公司的服务都很给力,,,,,,
l***8,2017/6/8 13:48,1717黑色,40,鞋子的款式不错，怪自己买小了一码！顶脚，赖得换了！物流快！果断直接好评！,,,,,,
呈***5,2017/6/10 8:22,1717棕色,41,穿上效果不错，女朋友说好看，自己喜欢就好。,,,,,,
李***8,2017/6/11 19:24,1717棕色,44,鞋很好，我很喜欢，穿着很舒服，不臭脚，黑色的上班穿，白色的在家穿，物流也挺好，五分,,,,,,
只***醉,2017/6/12 18:38,2323白黑,43,2017年6月1日，是一个终身难忘的日子，那天我收到鞋子马上穿着去上街，这件鞋子穿出了英姿飒爽的风度和帅气的背影，并且吸引了所有路人的，其中包括提刀的小混混，他们要把我穿的鞋子脱下来给他们看，我当然不干！如此好看的鞋子我一定拼了命的保护。最后我双手难敌三刀，进了医院，当我醒来的时候，鞋子没了，我握着拳头迟迟没有打开，我发誓以后还要买一件。,,,,,,
天***用,2017/6/10 9:40,838黑红,43,看了好几天才买的，期待已久，宝贝入手，还是很不错的，挺实惠的一次购物，款式样型都好看，就是太亮眼，哈哈，还送了袜子，谢谢老板,,,,,,
从***光,2017/5/2 12:52,838黑金,42,1.包装鞋盒好香，放了一个香包，商家有心了。 2.手工制作，感觉特别上档次。 3.很好看，穿上也特别舒服。 4.可以休闲，可以运动，半个月内又保修。 真的特别实惠了。,,,,,,
l***0,2017/5/15 17:26,1717棕色,44,穿了几天才来评价，物美价廉的鞋子，穿着很有型，送了袜子还有香包，精致穿着也舒服，很喜欢鞋的外观，也是百搭的鞋,,,,,,
精***z,2017/5/1 19:11,838黑白,41,鞋子试了下，前脚掌很软，穿着舒服，版型好看，配我的休闲裤，牛仔裤都可以。价格便宜必须好评。,,,,,,
w***9,2017/4/22 16:10,1300黑色,41,不错，做工很好，细心，耐脏，良心产品，在淘宝上很划算了，排名靠前说明东西还是不错的，不打脚，比一些品牌要舒服。图片我穿的有点脏了，但是这个很好洗，用洗衣服洗完超级干净，6的一批，超级喜欢，准备再来一单。,,,,,,
a***2,2017/5/18 16:41,1717棕色,41,宝贝到手就试穿了一下，感觉很值，比较舒服，而且款式也很好看，完全看不出是几十块钱的东西，实物和图片也是一样的，很赞，好评不解释。 耐磨性很好！ 服务很好！,,,,,,
1***叶,2017/5/5 14:48,A877白绿,42,宝贝收到了，穿在脚上确实很漂亮，我穿42码的，放一个鞋垫正好穿上，建议朋友们买的时候，按照正常码数拍小一码，新鞋子穿上正好，一段时间后就会变大的，我买来为了是晨练，很养脚，下次有需要还会再来的,,,,,,
辛***疯,2017/4/27 11:09,1717棕色,41,搭配一条深色裤子还是挺不错的，鞋底像是橡胶底，喜欢这种底，趁着天还不太热抓紧穿几天，只求淘到不开胶的鞋子,,,,,,
红***g,2017/4/30 23:41,1933黑红,44,给哥哥买的穿上可帅了 发货速度快 送的有运费险挺周到的 做工也不错鞋子上的涂鸦很有个性 是标准码 真的是物美价廉 包裹里面还放了香包 会继续关注和光顾你们家的 希望不会失望哦！,,,,,,
w***2,2017/5/24 21:27,5570黑白,43,鞋子很快就收到啦！物流特别的快，非常值，做工也非常的精细，在黏胶的地方完全没有看出溢胶。关键是穿在脚上非常的舒适没异味，与描述的完全一致，鞋底比较舒服一点都不算硬。想再入手一个颜色换着穿，很百搭以后就认准你家了。满意满意满意。,,,,,,
刘***淞,2017/6/6 12:21,238黑红,42,非常棒，真的，原本没对这个价位的鞋子报希望的，没想到上脚后感觉很舒适，很透气，仔细看做工也很棒，真的是喜出望外！良心厂家！以后还会继续关注！,,,,,,
单***人,2017/5/28 16:21,D01白色,44,东西漂亮，穿着舒适，透气，夏季凉爽，上身效果好，配牛仔裤，纯白上衣很不错,,,,,,
t***2,2017/5/22 16:44,838黑色,42,鞋子到了，很好看，质量也还可以，这个价格买的不错了，建议大家都可以来看看，鞋子收到啦！质量特别好，跟图片一模一样啊！下次还会光顾小小店的。 很好,,,,,,
l***8,2017/5/25 15:43,1933黑红,42,鞋子质量还是不错的，虽然客服小妹一直联系我给五星好评，但是我本着负责的态度特意穿了几天再来评价的，首先我的脚是四十一码半，拍的四十二码很合脚。再来我的脚也是臭脚，这鞋子也不是很臭。新鞋穿着很舒适，没有打脚等现象。我马上又买了一双。性价比很高的鞋。值得购买,,,,,,
h***y,2017/4/20 19:33,5570全黑,41,尺码合适，穿着非常舒服，这个价钱真的很值！款式也是我喜欢的样子，美中不足的就是印花只有半边。总得来说很好,,,,,,
t***2,2017/6/8 19:29,1717红色,43,鞋子非常时尚，穿着也很舒服，老公很喜欢！跟图片上一样漂亮！图片上的鞋子已经被穿了几天了，有点脏了！?,,,,,,
s***g,2017/4/17 16:31,1717黑色,42,收到鞋子打开有点超乎想象的好，送了袜子还有一个香草，快递在路上这几天把鞋都熏得香喷喷的，鞋子也如展示的一样好看。因为最近疯狂的学滑板，特别伤鞋子，买了双便宜的鞋子，这双鞋子不错，又便宜又好看又解释，现在买了东西很少评价，这个写这么多主要是觉得这家店做的特别用心，我喜欢用心做事情的人！,,,,,,
t***1,2017/6/1 20:56,1717黑色,42,刚刚好合适我，穿了几天穿起来很舒服，质量很好，几天都没烂，刚穿的时候给同事看到说我这双鞋好看，还有卖家服务很好，价格实惠，好鞋子,,,,,,
o***随,2017/4/23 15:48,838黑金,43,这鞋子真不错。女朋友帮选的。我本来不想要的，毕竟这么便宜的鞋子感觉好到那里去，又不能试穿。等鞋子回来看包装很差。。等拿出鞋子，想抱怨的话说不出来了。因为各方面看起来都还不错。穿上后也挺舒服。特意上来给个好评！实惠，穿着舒服。觉得很不错很超值。,,,,,,
q***1,2017/6/3 23:07,1717白黑,43,鞋子早到了都穿脏了才来评不好意思了，鞋子质量很好穿的挺舒服的，物有所值挺划算的性价比不错比实体店里便宜,,,,,,
s***6,2017/4/19 10:14,838黑红,42,鞋子已经收到了，非常拉风，嘻哈风格很潮，穿着挺舒适的，也透气，夏天用正好！,,,,,,
z***5,2017/6/2 11:19,1793黑金,43,质量没话说，好看，轻便透气反正弟弟非常喜欢，他说要我赶紧给姐夫买一双,,,,,,
买***i,2017/5/26 21:21,838黑白,42,2017-05-19 穿了几天很舒适，质量很好，样式好看，做工也很好，服务不错，这个是我买东西以来最满意的一次，这鞋子感觉非常非常的好，便宜实惠质量又好，穿着很舒适必须好评，以后买鞋就你家了！收藏店铺了！鞋子的跟高舒适度非常好，这是有良心的鞋店，真心推荐你以购买！,,,,,,
x***泪,2017/4/26 21:30,1717棕色,42,鞋子收到了，跟图片上的一样，没有色差，老公非常满意！就是邮寄的时候出了个小插曲，第一次发货没收到，跟客服联系了之后很快就给补发了一双，五天就邮寄到了，虽然晚收到几天但看到老公喜欢的样子还是挺开心的，好评是一定要给的！赞赞赞！！！,,,,,,
开***9,2017/5/28 6:50,1717黑色,41,质量很好，做工精细，鞋码很标准，底材穿着舒服又软乎，面料不错，孩子说非常喜欢，价格也超值，会再来的,,,,,,
w***4,2017/5/4 11:55,1717黑白,42,鞋子款式非常好，价格实惠，干的活是铝合金，这个厚度也可以，防滑最重要！话不多说，上图，很好看吧,,,,,,
砍***孩,2017/6/7 22:03,1717红色,41,鞋子收到了，抱歉这么久才评论，质量还是不错的，这个季节穿着挺舒服，样子也不错，而且价格可以，值得一买,,,,,,
w***8,2017/5/8 8:11,1717棕色,41,宝贝收到了，跟描述的一样，鞋码号正规，颜色和花纹搭配很到位，适合年轻人，鞋底防滑耐磨而且不易断，质量很好，时尚好看，性价比很高，我很满意，下次还会再来的，我赞评5分,,,,,,
l***7,2017/5/25 16:51,1717黑色,43,鞋子与图片一致，样式好看，底软透气，时尚，很喜欢，尺码准确，需要再来。,,,,,,
琴***8,2017/5/16 13:36,838黑白,41,我爱人平常不怎么爱穿布鞋，这次他偶然看到这双布鞋后，觉得还不错，也想穿双布鞋了，呵呵，前天晚上拍的，今天就到了，他还说咋这么快就到了啊，试穿了一下，效果还不错，就决定要了。,,,,,,
孤***灵,2017/5/27 13:41,D01白色,42,鞋早就收到了，一直没穿所以就没评论，最近穿了两天，感觉鞋码挺正常的，没有太大的偏差，款式也不错，价格也比较便宜，就是夏天穿稍微有点捂脚（可能是我个人体质问题吧）鞋底不算太软，不过并不影响走路，就是感觉颜色选错了（刚穿一天就被我整埋汰了）建议店家提醒一下快递公司，轻拿轻放，最起码不要像我收到的这个一样（鞋盒有一个角被怼进去了，还好鞋没事）,,,,,,
x***5,2017/4/15 8:09,838黑白,41,鞋子已收到，质量非常好，鞋底很软穿上很舒服，没想到四十几元能买到质量这么好的鞋子真的太划算了，店家还贴心的送了一双袜子，下次有需要会再来，全五星好评！,,,,,,
阿***u,2017/5/6 18:15,1717棕色,40,不好意思    评论迟了    宝贝很满意   鞋底软  穿起来很舒服   手感不错   就尺码有一点偏大    反正值   下次继续这家店了,,,,,,
t***1,2017/4/20 18:44,5570全黑,39,宝贝很适脚，穿上很舒服，颜色纯真，面料透气性好，值得再买，好评。物流公司也很给力。?,,,,,,
袁***6,2017/5/8 15:28,1793黑金,42,42 打开第一眼外观精致，细看做工也不错，穿起来也很舒适合脚 很满意的，而且的袜子质量感觉蛮好的,,,,,,
童***燕,2017/5/14 13:04,838黑白,39,05.12  鞋子和图片上一样，样式好看.，质量非常好，我儿子很欢喜， 鞋子挺舒适的，挺好的，价格也不错， 厚实 时尚，总体来说，品质不错。 鞋子收到好多天了，才来评价，见谅，物流速度没话说相当快，超乎我的想象，鞋子质量也没的说，轻巧时尚，无异味，而且价格也很实惠，下次还会来的，就是没送双袜子。,,,,,,
黄***m,2017/4/24 13:16,1717棕色,40,给我表弟买的，他说穿着很舒服，也很好看，质量也非常的赞，款式也是非常的好看，价格也非常实惠，下次还会光顾哟。,,,,,,
z***8,2017/6/2 8:29,1300黑色,43,宝贝已经收到，质量不错，款式新颖，穿起来很舒服，也好搭配衣服，给予好评！,,,,,,
东***头,2017/6/7 22:57,1300黑白,43,评论有点迟，不过这样才更有话语权，经过一段时间的使用，更加能发现此鞋的优点，不仅帅气耐穿，而且真的很舒服，也不捂脚，十足的休闲范儿！,,,,,,
今***4,2017/6/3 21:40,2323白红,41,鞋子早就收到了，我一般买东西很少评价，只有在没事的时候，鞋子跟图片上的一模一样，感觉非常不错，物美价廉，喜欢的朋友赶紧买，我不是拖并不是为了那好评返现I don&apos;t care ，总之喜欢赶紧买吧,,,,,,
喜***2,2017/5/6 8:54,1717黑色,42,这双鞋不仅外观精致，而且穿着也舒服，鞋底很厚正是我喜欢的类型。这双鞋在这店里买要有一倍价格才能买到。现在普通半价，哈哈真是太开心了。?,,,,,,
无***洋,2017/6/8 21:32,006黑红,43,鞋子已经收到，不错，很酷，包装的很好。质量很好，物美价廉。大爱。,,,,,,
妮***气,2017/6/10 18:57,5570全黑,39,鞋子非常棒，穿起来也合适,,,,,,
黑***人,2017/6/7 18:21,838黑红,40,鞋挺不错  穿上感觉也挺不错！   里面有个香包很好闻！,,,,,,
孤***瘾,2017/5/14 11:20,1717棕色,41,<b></b>此<b></b>用<b></b>户<b></b>没<b></b>有<b></b>填<b></b>写<b></b>评<b></b>论<b></b>!<b></b>,,,,,,
t***0,2017/6/10 18:12,D01黑白,41,鞋子非常好看，打开盒子里面里面有充电宝一包香粉贼香，鞋子质量很好。好评！,,,,,,
秋***丶,2017/6/9 16:14,006黑红,42,鞋子穿着很舒服，样子也很好看。,,,,,,
w***i,2017/6/12 9:32,1717黑色,44,鞋子质量很好，穿着舒适，帆布面刮都刮不坏，好评,,,,,,
唐***3,2017/6/10 0:08,1717黑金,42,鞋子穿着很舒服，很好看，百搭,,,,,,
x***6,2017/6/9 15:09,A877黑白,44,耐折性：鞋子穿起来感觉不错的，用的料也可以，外观蛮好看的。大小也是刚刚好，做工不错，花纹看起来时尚，性价比也可以的，好评。。,,,,,,
只***逅,2017/6/11 11:01,838黑白,41,鞋子非常好看，穿的刚好合适，下次还回来这家店！,,,,,,
雄***1,2017/6/12 23:37,D01黑白,43,质量不错，穿着舒服，高端大气。鞋底软。透气不悟脚。他们都说要买。我介绍的，下回优惠点。,,,,,,
z***8,2017/6/2 8:29,1300黑色,43,宝贝已经收到，质量不错，款式新颖，穿起来很舒服，也好搭配衣服，给予好评！,,,,,,
w***i,2017/6/7 11:53,1717黑色,41,感觉挺好的，很满意，便宜实惠值得购买。,,,,,,
今***4,2017/6/3 21:40,2323白红,41,鞋子早就收到了，我一般买东西很少评价，只有在没事的时候，鞋子跟图片上的一模一样，感觉非常不错，物美价廉，喜欢的朋友赶紧买，我不是拖并不是为了那好评返现I don&apos;t care ，总之喜欢赶紧买吧,,,,,,
家***岗,2017/6/10 21:10,1352白黑,41,非常好，穿上很舒服，以后会多多购买，建议大家购买,,,,,,
柒***尘,2017/6/10 11:38,1717白绿,40,挺好的，这个价钱很值了，就是不耐脏，不过白色都这样～,,,,,,
l***空,2017/6/11 20:22,1717白绿,40,非常好的鞋，不搁脚，穿起来舒服，还慢透气，没有臭脚，，过段时间再买双,,,,,,
二***0,2017/6/11 15:46,006黑红,42,鞋子质量杠杠的，儿子特别喜欢，下次还会再次惠顾,,,,,,
王***下,2017/6/12 14:01,838黑白,40,穿了很久一直忘记评价了，买过来尺码刚刚好，很合适，穿起来也很舒服 还不错,,,,,,
天***6,2017/6/6 11:44,A877白红,40,盒子里有香包，一打开盒子，一阵清香扑面而来，鞋子不错，大小合适，鞋底应该防滑的，帆布挺厚实的，先穿一段时间，质量好的话，准备再买一双。,,,,,,
t***3,2017/5/17 19:00,238黑红,42,宝贝已经收到了，物流挺给力的，价格也实惠，东西也不错，穿起来挺帅气的，满意。,,,,,,
t***6,2017/6/2 17:08,1717棕色,41,鞋子穿起来感觉还是不错的，用的料也可以，外观蛮好看的。大小也是刚刚好，做工不错，花纹看起来时尚，性价比也可以的，好评。,,,,,,
笑***5,2017/4/25 19:25,1300黑红,44,鞋子很有型，颜色搭配很漂亮，鞋底很软，穿着舒适！价廉物美！卖家还贴心的放了薰衣草的香包，一打开香香的，心情也好了许多！,,,,,,
大***0,2017/4/16 17:11,838黑金,43,虽然鞋发错了，但是客服态度非常好，再看看鞋质量也不错，穿着也比较舒服，还没有异味，并且送了袜子，我也不想折腾，就不换了，质量还是不错的，这次就算了，以后可不带这样式儿的了！好评给了！,,,,,,
余***夏,2017/5/17 12:50,1717白红,42,我给五分好评，首先说质量，真没想到这个价格能买到这么好的鞋，无论是做工还是舒适度都大大超过了我的想象，好评！好评！好评！,,,,,,
清***子,2017/6/6 16:35,2323白黑,41,鞋子版型很好，而且这么便宜的鞋子居然不臭脚！透气性也很好！老公很喜欢，！给老板满分不要骄傲哦,,,,,,
没***海,2017/6/12 17:13,5570黑红,40,穿着感觉是挺不错的，鞋子挺好看的，穿着很轻的感觉，夏天穿不会太闷，也不容易有脚臭，50块很便宜了，物美价廉，还是希望多出点新的款式，比较好&hellip;,,,,,,
x***7,2017/6/2 14:45,A877白黑,43,版型不错，合脚，质量也行，已经穿这双鞋连续四天每天公司~宿舍6公里来回跑了，都没有坏，值得推荐,,,,,,
g***f,2017/5/13 20:00,1300黑金,43,收到货，感觉很好，很大气，质量也很不错，款式跟图片一样，穿上很舒服，挺透气的，脚也不会有异味！下次还来这家,,,,,,
路***生,2017/5/21 21:03,1793黑金,42,鞋子收到了，很棒，在这里也感谢客服和物流客服，我自己地址选错了，麻烦物流的多跑一下，物流也是很给力，鞋子质量还不错，新鞋味稍微有点重，底子是硬底，穿起开感觉有一点点重，不过没什么影响。祝店铺生意越来越好，提个小建议哈，店主真该给客服加班有点福利，那会儿十二点了还在。,,,,,,
t***8,2017/5/17 22:23,1717黑色,40,不好意思现在才来评价！买给儿子的我是让他穿上几天才来评价的！鞋子穿着舒服，而且脚还不会臭！下次还会光临,,,,,,
哥***滴,2017/5/30 20:27,1717白黑,39,质量很好 做工精细  鞋码很标准  鞋底穿着舒服又软乎  布料不错,,,,,,
玲***1,2017/5/16 21:39,1717棕色,42,宝贝收到鞋子穿着非常合脚又舒适。喜欢的亲们可以放心购买。,,,,,,
国***0,2017/6/5 10:33,1717黑金,39,我很喜欢这个造型的鞋子，感觉不错漂亮实惠又好看质量不错??,,,,,,
l***x,2017/5/28 17:12,CF09黑色,43,鞋子特别好，又买第二双，经济实惠，朋友都夸漂亮,,,,,,
f***n,2017/5/24 10:43,006黑红,40,尺码非常合脚 跑步什么的感觉很耐用 穿了两天非常不错，舒适,,,,,,
略***琐,2017/5/13 10:44,6608白蓝,44,厉害了我的哥，鞋子穿着很舒服鞋底特别软而且卖家还在鞋盒里放了一个香包真到位，不光有香包还随鞋赠送一双袜子。,,,,,,
邓***哈,2017/5/20 18:26,1717黑白,42,非常好！从来没买过这么漂亮的鞋。鞋底不硬，穿起来非常舒服，下次再来买,,,,,,
t***1,2017/4/24 14:11,1717黑色,41,鞋子下单一天后就收到了，很好很合脚，布料的夏天穿正好，物超所值啊，外面店铺卖起吗的几百，赚到了。想要的赶快下单了。,,,,,,
矮***丝,2017/6/6 17:29,1300黑金,43,尺码：43 鞋子质量也很好，鞋底耐磨也很软，性价比挺高的，质量赶紧不错，颜色比较百搭，看着韩版但是又很潮，穿几天再来评价，耐穿的话下次会再来光顾的。挺好的。,,,,,,
