庐***4,2017/6/12 17:25,1717白红,40,尺码合适 搭配的挺好看,,,,,,
云***号,2017/6/7 18:04,838黑色,40,货已收到，感觉还不错，总之这个价钱有这样的鞋子，不错。,,,,,,
我***1,2017/6/9 16:12,1717白黑,40,鞋子特别好看  穿着舒服 很时尚  值得够买。,,,,,,
哥***小,2017/6/4 15:03,1717白黑,39,这鞋不错 颜色也不错好 正品。穿着也舒服,,,,,,
l***4,2017/6/8 15:52,1717黑金,43,收到鞋子儿子很喜欢，大小正好，做工还可以，以后还会再买,,,,,,
繁***情,2017/6/9 12:50,1717白绿,41,鞋还是不错，根图片一致，对我个人来说觉得鞋子有点瘦了??,,,,,,
龚***n,2017/6/5 21:26,1717黑色,40,不错不错，价格也挺便宜的，也不知道能穿多久，挺便宜的，很帅,,,,,,
a***1,2017/6/10 14:13,1717黑金,40,鞋子非常好，看起来很时尚。赶紧下手吧！,,,,,,
t***0,2017/6/7 16:45,1300黑色,41,鞋子挺好的，穿起来舒服，大小也合适。值得信赖。,,,,,,
t***7,2017/6/5 17:11,2299黑金,43,鞋与图片上的差不多，穿起来也很舒服，第一次在网上买鞋，感觉还不错,,,,,,
我***奥,2017/6/11 17:07,1717白黑,41,啥毛病没有，穿上就是立正，推荐宝贝们购买。,,,,,,
l***2,2017/6/7 17:18,1300黑色,39,和图片一样码数也正，满意下次再来,,,,,,
大***鹰,2017/6/12 17:27,838黑红,44,鞋子很合脚，穿着也舒服，好看，卖家服务也好，有需要还来,,,,,,
x***2,2017/6/7 18:39,238黑金,43,挺好得。穿的也很舒服。质量也不错。性价比也高,,,,,,
c***p,2017/6/4 7:59,A877白绿,40,收到打开看到鞋子感觉就很好，鞋子很漂亮！,,,,,,
蓝***7,2017/6/7 20:10,1717黑色,40,鞋子是帮同事拍的，所以&hellip;&hellip;载图的话&hellip;&hellip;但同事蛮喜欢鞋子,,,,,,
秋***0,2017/5/17 10:35,1717红色,40,收货打开看后，惊爆我的眼球，性价比一流！完完全全超出了我的期望值！不多说了，图片送上！,,,,,,
刘***1,2017/5/20 11:27,1717红色,43,鞋子收到了，打开一看鞋子的确非常漂亮，穿着也很舒服   很满意  祝店家越办越红火,,,,,,
徐***1,2017/4/24 13:11,1717白黑,39,质量很好，也很好看，老公穿起来说很舒服,,,,,,
d***g,2017/6/7 10:03,1717黑色,43,43 鞋子非常不错 比较舒服 穿了快半个月才评价 确实不错,,,,,,
转***运,2017/4/21 13:16,1933黑红,42,宝贝很不错，没有色差，质量没问题，很喜欢呢，下次继续光顾,,,,,,
不***喜,2017/6/11 7:41,5570黑红,40,鞋子收到了，抱歉这么久才评论，质量还是不错的，这个季节穿着挺舒服，样子也不错，而且价格可以，值得一买,,,,,,
z***7,2017/5/17 20:34,1717黑色,44,鞋子的质量非常好，很漂亮，我十分喜欢 好评,,,,,,
幸***猪,2017/4/14 15:42,1717黑色,40,穿着很舒服，大小合适，而且款式也很好，最主要是价格便宜，很愉快的一次购物！老板很贴心还送了袜子！,,,,,,
嫌***唉,2017/5/10 13:53,3399黑金,44,快递很快，包装完好无损，很满意！ 好好的卖家，偶是新手，好多东东都不懂，还好有卖家的另一端耐心的指导，偶也好有成就感，终于弄懂了一直不太明白的问题^-^以后还要多多学习!卖家MM的水平很高,人也很有耐心,看到好多买家的评价都给的很高,没想到真的是这样的.像这样的卖家,在网上已经很少见了.我问过好多卖家了,都不能做到的,卖家MM都做到了.而且价格也低.真的好开心啊.卖家服务好，价格公道~!快递很快，包装完好无损！我很满意，可以的！！！
墨***陌,2017/5/26 12:06,1717白黑,41,跟我想的一样哦。穿起来挺好看的。下次继续光临。吼。穿起来特别舒服，,,,,,,
h***3,2017/5/14 11:34,CF09灰色,40,鞋子很好，穿起来很舒服，质量不错，很赞?,,,,,,
张***6,2017/5/24 1:50,1793黑金,42,非常好穿！舒服。帆布鞋美观还不错，下次还来。祝店主生意兴隆！,,,,,,
w***腻,2017/4/23 13:53,1300黑金,42,穿起来挺舒服的质量也很好可以重要的是自己喜欢就好,,,,,,
t***2,2017/6/2 17:51,5570全黑,42,实物比我拍出来的好看些。鞋子质量也很好，鞋底耐磨也很软，性价比挺高的，质量赶紧不错，颜色比较百搭，看着韩版但是又很潮，穿几天再来评价，耐穿的话下次会再来光顾的。发几张自己拍的实物照片供大家看下哈,,,,,,
t***8,2017/5/19 21:42,D01白色,42,相当完美帅气的鞋子   穿着舒适   透气性特别强   出去玩穿一点都不觉得累   价格便宜   还没有异味   只是评价晚了   很抱歉   祝店家生意兴隆财源广进    全五星,,,,,,
t***3,2017/5/19 0:12,1717黑白,41,<b></b>此<b></b>用<b></b>户<b></b>没<b></b>有<b></b>填<b></b>写<b></b>评<b></b>论<b></b>!<b></b>,,,,,,
浅***丶,2017/5/27 14:27,2299黑金,39,非常不错！码数也正确！价格实惠！跟外面100～200都不差了！！值得拥有！,,,,,,
艾***初,2017/4/19 18:54,CF09黑色,41,好看好穿不磨脚便宜实惠物流快,,,,,,
装***套,2017/5/3 13:44,1717黑白,41,尺寸刚刚好，下次再来购买，亲朋好友都说很好，你们喜欢的朋友也快点来购买噢。爱你。?,,,,,,
我***9,2017/4/25 23:44,1717棕色,42,两个字喜欢，夏天穿这种鞋子最舒服，而且也透气,,,,,,
超***6,2017/6/4 13:15,1717黑金,39,鞋子很快。很气派，穿起来非常帅！,,,,,,
陈***2,2017/4/23 3:26,3399黑红,41,这鞋子非常好看，我很喜欢，穿起来感觉很舒服，而且和衣服随意搭配，以后需要，我还会来这里买，谢谢老板,,,,,,
l***新,2017/4/27 14:15,1300黑白,41,鞋子很好，，老公穿上刚好。。他很喜欢！！想要的果断下单吧???,,,,,,
阿***店,2017/5/5 13:04,1717棕色,42,还可以，不贵，结实。上班穿下。好看。,,,,,,
d***9,2017/5/27 14:24,5570全黑,44,宝贝收到～物流快质量也满意～孩子很喜欢下次还会光顾本店铺,,,,,,
z***6,2017/4/27 22:09,838黑金,39,鞋子很漂亮，质量也不错，性价比非常高。下次还来。,,,,,,
回***一,2017/6/5 9:42,1717白绿,41,现在超级好看 买来跟网上的一样超级超级好质量也好 下次还要来买 好评,,,,,,
史***6,2017/6/6 17:10,2323白绿,43,挺满意   穿上也挺舒服的    样子也好看  物流就不用说啦  两天就到,,,,,,
弑***夜,2017/5/22 17:57,1717棕色,43,非常的好。经常在这家买鞋子了。这也是第五次在这家买鞋了。非常不错。因为我是一名厨师。经常在厨房里面。而且地也滑。有了这双鞋再也不怕滑了。非常不错。给个五星好评。码数合适，物美价廉，很喜欢鞋子外观时尚大气 穿着舒服 最主要的还是价格实惠 个人觉得很满意 值得购买！简直物美价廉，细节处理也很好十分满意 大小刚好合适超级好 在继续买，大家注意了 码子很准 ，自己多大就买多大 不用担心，亲身体验。很喜欢&hellip;&hellip;商品与描述一致，满意，下次还会来选购鞋子非常漂亮，穿着也很舒服，尺码也合适。还想再买一双,,,,,,
t***0,2017/6/5 17:34,006黑红,39,鞋子好看很合适已关注会在光临。,,,,,,
小***婚,2017/4/26 10:25,238黑红,40,宝贝棒棒哒  物流超级快哦  鞋子面料也挺舒服的。刚好适合          下次还来这家店哦,,,,,,
q***9,2017/6/5 20:05,A877白红,41,宝贝收到了，很满意的一次购物，老公穿上很合适，变的更帅了哈哈,,,,,,
t***i,2017/4/23 10:20,1717棕色,42,宝贝已经穿上了，很舒服，物美价廉,,,,,,
t***0,2017/4/13 22:41,838黑红,40,<b></b>说<b></b>实<b></b>话<b></b>，<b></b>价<b></b>格<b></b>非<b></b>常<b></b>便<b></b>宜<b></b>，<b></b>鞋<b></b>子<b></b>质<b></b>量<b></b>也<b></b>很<b></b>不<b></b>错<b></b>，<b></b>看<b></b>着<b></b>很<b></b>美<b></b>观<b></b>。<b></b>非<b></b>常<b></b>喜<b></b>欢<b></b>。<b></b>物<b></b>美<b></b>价<b></b>廉<b></b>，<b></b>穿<b></b>着<b></b>很<b></b>舒<b></b>服<b></b>，<b></b>而<b></b>且<b></b>商<b></b>家<b></b>服<b></b>务<b></b>特<b></b>别<b></b>好<b></b>。<b></b>,,,,,,
t***2,2017/5/9 10:43,1717棕色,42,快递很给力，鞋子老公很喜欢，穿着不捂脚，样子也很好看，价钱也便宜，很满意,,,,,,
张***a,2017/4/29 12:44,CF09灰色,40,鞋子收到了，大小正好，是正品，质量也非常好，祝卖家生意兴隆。,,,,,,
橙***3,2017/4/17 20:04,1933黑红,40,鞋子收到了，质量不错。码数很标准，老板还送可一双袜子。下次还回来光顾的，祝老板大买。,,,,,,
齐***梦,2017/5/28 13:59,1717黑色,43,宝贝很好哦穿到脚上很时尚呢快来购买吧,,,,,,
j***5,2017/4/25 10:32,A877黑白,41,款式很时尚，脚感也不错，而且没有异味，物超所值吧。,,,,,,
y***1,2017/5/2 21:09,1717棕色,44,鞋子不错，穿两个星期了还没刷，穿着挺舒服的，下次会继续光临的，争取给点小礼物什么的,,,,,,
阿***生,2017/6/10 15:13,006黑白,40,物美价廉，款式新颖，脚感好，客服态度好！,,,,,,
苏***呼,2017/6/7 19:39,1717黑色,41,给男朋友买的，男朋友非常喜欢，样式也很好看。,,,,,,
回***机,2017/6/12 7:50,7116黑金,44,刚买来的时候可以  几天之后就就走样了,,,,,,
快***点,2017/6/3 16:38,838黑红,39,喜欢，，，样子也好看，，质量也不错。,,,,,,
t***3,2017/6/7 20:23,1717白绿,42,很酷哦,,,,,,
t***2,2017/6/7 22:26,1717黑色,43,外观看起来挺不错的  穿起来也特舒服的  个人挺喜欢的,,,,,,
世***代,2017/6/4 19:00,006黑红,42,宝贝刚收到啦，穿起来脚还蛮舒服的，好评。,,,,,,
邬***晴,2017/6/5 14:43,1717白红,42,很好看，刚到货，兄弟就喜欢的不得了，先借兄弟过把瘾。,,,,,,
一***磊,2017/6/3 15:05,1717红色,43,鞋不错 外观好看 质量也不错,,,,,,
陈***2,2017/6/8 19:10,7116黑金,40,不错，穿着很舒服,,,,,,
南***海,2017/6/8 20:52,1717黑色,42,鞋子还不错，很实用，舒适！,,,,,,
非***0,2017/6/10 20:57,1717黑金,42,给弟弟买的，我没有见到实物，不过他很满意，所以五分哦,,,,,,
流***啦,2017/6/8 17:59,1717白黑,43,收到鞋很满意，没想到这么好看，可惜忘了照照片了，很愉快的购物，下次还要来,,,,,,
t***1,2017/6/5 14:04,1717黑金,42,外形样子都还不错，号码也标准,,,,,,
西***翼,2017/6/10 18:01,838黑白,43,东西很不错的，客服小哥也是很棒的，就是开口一句姐叫的我好蓝瘦。。。,,,,,,
t***0,2017/6/10 16:41,1717黑白,40,太棒了，非常的好穿，鞋底比较的厚，不像以前在网上买的鞋底薄,,,,,,
s***贝,2017/6/10 9:29,1717红色,40,鞋子的质量不错，尺码大小很合适，穿在脚上很舒服，我很喜欢。。,,,,,,
长***家,2017/6/5 9:22,X6灰色,43,宝贝比想像中要满意，穿上挺舒服下次还来。穿了几天追评,,,,,,
q***7,2017/6/8 20:10,A877黑白,41,鞋子挺好的。很喜欢，穿着也很舒服。以后会再来的！,,,,,,
贱***头,2017/6/9 20:21,1717黑金,42,穿着  感觉很在   穿着不会臭脚     很帅气   适合中少年的一双帅鞋,,,,,,
纪***a,2017/4/22 13:03,1717白黑,42,鞋子非常漂亮，价格非常实惠，快递速度也很快，棒棒哒！,,,,,,
t***2,2017/5/24 11:26,1717棕色,42,儿子很喜欢，物美价廉，特别好，穿起来酷酷的！,,,,,,
黎***7,2017/5/23 11:50,1717棕色,42,挺喜欢的鞋子，下次还会再来买,,,,,,
t***7,2017/5/30 18:00,D01白色,42,刚拿到，还没穿，但是看着还是挺不错，物流业挺快，摸了一下鞋底，柔软应该挺防滑的,,,,,,
小***3,2017/5/29 20:50,2323白红,43,鞋已收到，质量很好，物流很快，我爱人炒鸡喜欢，还会再来的,,,,,,
温***治,2017/5/18 21:15,1793黑金,42,鞋子收到，质量好，透气，夏天正好穿，儿子喜欢，上学直接穿走了，好评五星！,,,,,,
x***球,2017/5/12 13:49,838黑白,42,鞋子很好，老公很喜欢，价格挺优惠，比实体店几百的要好的多，喜欢的朋友可以下手了。快递也非常快。,,,,,,
t***1,2017/5/16 8:02,1717红色,42,真的是非常的好 又便宜又实惠 真的很不错,,,,,,
宏***箭,2017/5/4 12:08,1300黑红,40,大小合适，感觉鞋跟漂亮，穿着很帅，物流也很快，好评没毛病，下次还会来这家,,,,,,
长***3,2017/5/2 20:41,1933黑红,44,鞋子收到了，很不错的样子，大小合适喜欢,,,,,,
z***6,2017/5/5 20:50,1300黑红,42,1.包装鞋盒好香，放了一个香包，商家有心了。 2.很好看，穿上也特别舒服。 3.可以休闲，可以运动，半个月内又保修。 真的特别实惠了。,,,,,,
4***视,2017/5/17 16:02,5570全黑,44,鞋子收到了，非常满意，颜色很正很耐看，而且很便宜抓紧时间购买吧,,,,,,
p***2,2017/5/2 22:13,1717红色,42,和店长描述的一样，蛮不错的，穿在脚上很舒服，看起来挺大气的。给好评支持，下次有机会继续买。,,,,,,
5***乐,2017/4/22 21:04,1717黑色,39,鞋子和图片一样。质量也很好。尺码标准。儿子很喜欢。好评,,,,,,
t***5,2017/5/23 17:53,D01黑白,41,鞋子不错，质量还行，穿着也舒服。价格很实惠，我很喜欢，  ?店主生意兴隆，越来越好！,,,,,,
最***y,2017/5/6 19:11,838黑红,42,鞋子很好看，穿着很舒服，弟弟超喜欢的,,,,,,
t***2,2017/5/14 18:58,838黑金,44,鞋子不错，挺好看的，也很软，就是夏天会有些热,,,,,,
宁***良,2017/4/27 19:09,1717红色,42,不错  穿着很舒服  表示还来,,,,,,
t***5,2017/4/22 14:30,1300黑金,40,非常的不错，很舒服，价格也特别的实惠，物流非常的给力，非常满意的网购啦，5分好评妥妥的,,,,,,
帅***洁,2017/4/16 16:02,1717红色,42,鞋子很软很舒服，快递很迅速！款式不错，值得购买！,,,,,,
t***6,2017/6/6 9:45,1717白绿,42,宝贝很好&hellip;&hellip;大小也正好,,,,,,
l***5,2017/6/11 21:36,1300黑白,39,很合适咧，老公脚比较小，我的比较长，感觉我都可以穿了,,,,,,
a***泽,2017/6/9 22:57,A877黑白,40,鞋子不错非常满意，穿着很舒服,,,,,,
Y***影,2017/6/10 21:39,838黑金,43,质量很不错，也比较舒服，可以优先选择的好东西，而且物理也比较快！点个好评，希望光大顾客好好看看！,,,,,,
叱***o,2017/6/1 14:05,006黑白,43,一打开一股香味就来了，鞋子很美，物美价廉，欢迎大家来买,,,,,,
买***i,2017/5/26 21:21,838黑白,42,2017-05-19 穿了几天很舒适，质量很好，样式好看，做工也很好，服务不错，这个是我买东西以来最满意的一次，这鞋子感觉非常非常的好，便宜实惠质量又好，穿着很舒适必须好评，以后买鞋就你家了！收藏店铺了！鞋子的跟高舒适度非常好，这是有良心的鞋店，真心推荐你以购买！,,,,,,
t***4,2017/6/5 12:55,1300黑白,41,挺不错的  也透气  不热   下次还来这,,,,,,
2***i,2017/6/11 0:25,1717黑金,42,很好的鞋子   穿上非常舒服  很喜欢,,,,,,
w***5,2017/6/12 20:04,X6黑白,41,鞋子不错，穿着舒服。五颗星好评，没法晒单，在上班,,,,,,
唧***歪,2017/6/4 18:07,A877白黑,39,鞋子很喜欢。有点紧，但是很合适。看上的购买呢,,,,,,
君***4,2017/6/4 11:42,1717白黑,41,鞋子很好，就是有点异味，用香包清一下就好了。挺不错,,,,,,
遗***了,2017/6/11 9:11,D01黑白,41,长得还不错，不过香包太香了，就是不知道穿着会不会臭，有机会再追评吧,,,,,,
何***鹤,2017/6/12 18:19,1717白黑,44,鞋的质量都挺好，穿起来也挺舒服的,,,,,,
唯***9,2017/6/10 23:04,1717红色,44,质量不错，值得购买,,,,,,
开***9,2017/5/28 6:50,1717黑色,41,质量很好，做工精细，鞋码很标准，底材穿着舒服又软乎，面料不错，孩子说非常喜欢，价格也超值，会再来的,,,,,,
树***丹,2017/6/12 21:42,1717黑金,41,宝贝很好，价格合理。质量一流，值得你拥有,,,,,,
m***仔,2017/6/9 10:05,1717棕色,40,穿了几天。 感觉还不错,,,,,,
墓***丶,2017/6/5 21:50,838黑金,41,宝贝很好，有点偏小，一个码，建议拍大一个号，也可以，质量不错，下次还会买,,,,,,
t***0,2017/6/4 20:41,1717棕色,41,鞋子很好 穿着也挺合脚的 看着样子还不错 喜欢的朋友可以买来试试,,,,,,
美***8,2017/6/1 23:55,2299黑金,40,鞋子质量好穿了很舒服不错?,,,,,,
咖***在,2017/6/12 17:35,A877白黑,40,很好 非常满意 很好,,,,,,
l***9,2017/6/8 18:49,238黑金,40,尺码合脚。和图片一样,,,,,,
w***8,2017/6/7 20:38,1793黑金,43,<b></b>此<b></b>用<b></b>户<b></b>没<b></b>有<b></b>填<b></b>写<b></b>评<b></b>论<b></b>!<b></b>,,,,,,
请***啊,2017/6/9 21:25,1717黑白,42,非常好，穿着也舒服，物流也很快,,,,,,
丁***g,2017/6/8 21:04,1717黑色,40,鞋不错，穿上挺好看，跟想象的一样，也挺舒服，不磨脚，值得购买,,,,,,
昼***1,2017/6/9 20:39,5570黑白,40,非常好，高端、大气、上档次，你值得购买。,,,,,,
爱***名,2017/6/10 14:02,006黑红,40,鞋子质量很好，穿起来也很舒服，,,,,,,
忘***0,2017/6/12 21:49,1352白黑,42,宝贝很好，质量不错，跟照片很相符，尺码也对，客服态度也很好，支持,,,,,,
包***7,2017/6/6 23:00,838黑白,41,宝贝收到了，打开鞋盒的那一刻，一下子惊呆了！！！！质量非常棒，么么哒！做工细致，设计合理，舒适度很好，鞋底很软，透气性很强，颜色漂亮，喜欢，大爱&hellip;&hellip;&hellip;！,,,,,,
郭***头,2017/6/6 17:42,1717黑白,40,鞋质量非常好穿着也特别舒服,,,,,,
a***5,2017/6/8 22:53,838黑红,40,讲真，鞋子真的好，没有一点味道。也不臭脚，这个价位超值的,,,,,,
z***i,2017/6/4 21:10,238黑金,40,穿起来开车非常舒服。,,,,,,
c***9,2017/6/8 21:14,1717红色,42,好看，满意，大小也合适，还会再光顾的,,,,,,
丢***谋,2017/6/6 10:47,2323白黑,43,大小刚好，质量不错，喜欢的赶快入手吧！,,,,,,
l***4,2017/6/9 12:41,3399黑红,40,鞋子特别好，我弟弟也很喜欢，给个好评,,,,,,
啊***了,2017/6/10 21:06,2323白黑,39,这是第二次买  帮朋友买的  穿着舒服而且好看,,,,,,
我***3,2017/6/11 7:38,1717黑白,41,两双一样一支。穿的就是个性 哈哈,,,,,,
l***7,2017/6/8 18:01,1717黑色,41,鞋子蛮好看的不错的一次购物选择，下次还会来买,,,,,,
c***8,2017/6/10 12:15,A877白绿,40,鞋子质量不错，穿起来很舒服，值得推荐！！！,,,,,,
淼***t,2017/6/4 17:26,1300黑金,41,货已收到，物流好快的，鞋的质量非常好值得购买，这已经是第二次购买了。,,,,,,
用***爱,2017/5/18 17:48,1717棕色,42,鞋子很快就收到啦！物流特别的快，非常值，做工也非常的精细，在黏胶的地方完全没有看出溢胶。关键是穿在脚上非常的舒适没异味，与描述的完全一致，鞋底比较舒服一点都不算硬。想再入手一个颜色换着穿，很百搭以后就认准你家了。满意满意满意。宝贝收到了质量不错很图片很相似，刚收到就迫不及待的穿着感觉挺舒服的！给力！,,,,,,
张***文,2017/6/9 20:22,7116黑金,41,鞋子不错 挺好看的 穿着也可以,,,,,,
爱***昊,2017/6/7 20:43,2299黑金,42,鞋的舒适度不错，质地也好，嗯质量也很好，我挺喜欢的，穿上也舒服。,,,,,,
g***1,2017/6/10 11:17,3399黑金,44,鞋子很好，也不咯脚。挺好?好评。,,,,,,
d***9,2017/6/9 21:28,1300黑红,43,穿了几天，挺好的，大了些，再买一对小一号的,,,,,,
小***0,2017/6/12 19:22,1717棕色,43,鞋子不错，穿着挺舒服的，也不臭脚,,,,,,
风***5,2017/6/9 19:50,D01黑红,42,回购的！穿着挺舒服！老公很喜欢,,,,,,
h***1,2017/6/7 20:31,1717白黑,40,很喜欢尺码刚好外脚长25.5选的是41码,,,,,,
余***2,2017/6/8 10:20,238黑白,39,给弟弟买的，质量很好，而且价格也很便宜。值得学生购买呦。,,,,,,
玖***爷,2017/6/4 20:06,2299黑金,42,号码正好，感觉棒棒的，很合算，很舒服，买的值了,,,,,,
a***玩,2017/6/7 17:55,1300黑红,43,与商家说的一致  这鞋没毛病  快递也到位  全给五星,,,,,,
为***何,2017/6/3 14:51,1300黑红,40,鞋子非常好，我非常喜欢！一次愉快的购物体验！,,,,,,
t***3,2017/6/7 12:49,838黑金,43,尺码很合适，外形也很漂亮，还不错的鞋。,,,,,,
此***吧,2017/6/7 20:52,2323白绿,40,特别好  柔软舒适  鞋子还很轻快,,,,,,
傻***y,2017/6/10 11:05,1717黑金,40,我们家，爱森狼店铺就是好，买来特别好看，特别适合，大家放心大胆买。我Promise,,,,,,
6***w,2017/6/4 0:59,238黑红,42,尺码：质优 样式美 发货快 服务好。,,,,,,
燕***舞,2017/6/10 18:47,CF09灰色,40,鞋子不错，很合脚，唯一遗憾就是我没买好裤子,,,,,,
杭***4,2017/6/11 17:41,2299黑金,40,还可以，穿起来挺舒服的，软软的合脚,,,,,,
雨***伤,2017/6/1 11:39,1717黑色,43,鞋子很不错，，物流也快，穿着舒服，还便宜，下次还来,,,,,,
诠***丑,2017/6/12 15:46,3399黑金,42,收到货了。感觉很好,,,,,,
唐***猪,2017/6/12 21:55,3399黑金,40,五星,,,,,,
h***嘻,2017/6/10 15:01,1352白黑,42,宝贝收到了。和理想中差一点，不错面料不错。习惯好评,,,,,,
洞***3,2017/6/7 12:07,X6黑白,43,宝贝不错，挺好看的，还没来得及穿，不过我相信肯定不差,,,,,,
伟***q,2017/6/4 13:22,1717黑白,40,鞋子很好，就是左右有点紧，不知道是不是拍小了，总体穿的很舒服，看起来很酷，最赞的就是质量相当不错，全五星好评,,,,,,
果***熊,2017/6/1 15:26,1352白黑,44,穿着挺合适，款式也挺好看的,,,,,,
t***6,2017/6/4 16:54,1717黑色,42,货物收到了，试了一下脚，合适OK，好评。,,,,,,
y***1,2017/6/8 7:57,A877白绿,41,鞋子非常不错，很合脚，穿着很舒服，物美价廉，朋友都说很好看的鞋子,,,,,,
c***e,2017/5/30 14:17,1717白黑,39,这个香包打开好香，不像别的鞋子打开的新鞋子味道，给个赞，双击评论666.哈哈，总体来说鞋子款式比较百搭。很值得购买吧，虽然我第一次买,,,,,,
天***7,2017/6/11 16:39,1717红色,42,买了东西    一定要评价么  老实打电话来  烦死了,,,,,,
涵***7,2017/6/4 17:22,1717黑色,42,很好的鞋子，很好的款式，穿着很舒适，大小尺码刚好，给五分好评。,,,,,,
唐***3,2017/6/10 0:08,1717白红,42,鞋子很不错，很透气，夏天穿舒服,,,,,,
阿***瑰,2017/6/7 16:54,1717棕色,40,我帮朋友的小孩子买滴，不知咋样，习惯性好评,,,,,,
上***争,2017/6/12 19:21,838黑红,44,挺不错的鞋子，也合脚，挺撑劲的,,,,,,
萌***想,2017/6/4 19:00,838黑金,43,鞋子不错，可以用了，舒服,,,,,,
代***宇,2017/6/10 11:03,838黑金,42,穿着很舒服，也挺合适，样子比较喜欢,,,,,,
号***家,2017/6/3 21:21,1717黑金,39,穿起来很舒服  鞋垫也很舒服,,,,,,
号***家,2017/6/3 21:21,1717黑金,39,穿起来很舒服  鞋垫也很舒服,,,,,,
y***0,2017/6/2 16:56,5570黑红,43,鞋子收到几天了，一直很忙，今天才来评价。鞋子穿着舒服，鞋底比较柔软，夏天稍微热点，性价比比较高，全五星！,,,,,,
t***2,2017/6/7 18:48,1300黑色,43,大小刚好。物流快。收货几天没时间。穿了几天才来评价。穿起舒服。象图片一样。全5分,,,,,,
0***4,2017/6/9 21:31,838黑金,42,鞋子质量很好，透气性也很好,,,,,,
强***泽,2017/5/18 9:46,D01白色,39,鞋子质量很不错 比想象中的好 挺满意的 穿鞋舒服,,,,,,
t***7,2017/4/29 13:14,2299黑金,40,还不错 穿起来舒服好看  下次再来,,,,,,
z***5,2017/5/3 17:22,CF09灰色,40,很满意哦，不错不错，穿上非常合脚，很漂亮,,,,,,
9***霖,2017/4/14 9:15,1717棕色,41,实物比想象中的更好！老板送的短袜穿着刚刚好！,,,,,,
哥***线,2017/4/29 20:39,1717棕色,41,首先声明不是拖。收到后迫不及待就打开了，质量是很不错的，手感也很舒服，超赞,,,,,,
凡***9,2017/5/18 19:59,1717棕色,41,非常喜欢 物美价廉 算是最满意的一次网购 真心推荐大家,,,,,,
雨***琛,2017/6/1 19:09,1300黑白,42,鞋子很好 性价比很高 送来的时候 鞋子里有香包 没有异味 挺不错 推荐,,,,,,
h***7,2017/5/7 9:44,1793黑金,43,鞋子穿着很舒服，料子很好，版型也漂亮，总体来讲不错，对得起这个价格。,,,,,,
夜***f,2017/5/25 15:50,D01黑白,40,已经穿了几天，总体感觉很好，鞋底很软，透气性也不错，码数也比较合适，果断好评！?,,,,,,
三***8,2017/5/9 20:16,838黑色,43,打开鞋盒子有一股香气，不错很满意，鞋码很标准穿上去正好，很喜欢，物流速度很快很到位。,,,,,,
t***5,2017/5/31 10:48,X6黑白,43,鞋子不错儿子喜欢，计划再够一双鞋子，五分好评!,,,,,,
t***6,2017/6/5 0:23,1717白黑,41,鞋子不错  很喜欢价格很适合物有所值,,,,,,
小***爱,2017/4/28 20:52,838黑白,41,宝贝很不错，弟弟很喜欢，外观很时尚，很酷，值得大家购买！,,,,,,
初***顾,2017/5/11 13:50,D01白色,42,刚收到货我就穿上了，很舒服，看着也很好看，过两天再来买一双。,,,,,,
玲***网,2017/5/2 0:09,1717黑白,42,儿子买的，他很喜欢，买到后第二天就穿上去了，而且很舒服，给好评。,,,,,,
阿***子,2017/4/18 13:15,1717棕色,44,鞋子很不错！穿着舒服，不磨脚，关键还好看哈哈~~希望以后会做得更好！,,,,,,
